Rank,First Name,Last Name,Team,Position(s),Runs,Home Runs,RBIs,Average,Steals,Wins,Losses,ERA,WHIP,Strikeouts,Saves,Blurb240,Placido,Polanco,,3B,74,5,52,0.268,4,,,,,,,"I was thinking I've never seen such a terrible tier of players before, then Crapolanco has to go and up the ante.¾ Or maybe that's down the ante.¾ Maybe I'm just anti-Polanco."241,Chris,Johnson,,3B,52,13,59,0.274,4,,,,,,,"This is a new tier.  This tier goes from here until Stewart.  I call this tier, ""Upside, but more question marks than the Riddler's leotards.""  Here's what I said when the Diamondbacks signed Eric Chavez, ""DêBacks signed him to platoon with Chris Johnson.  Thatês the Chris Johnson who doesnêt need a platoon partner.  Yay.  Like your best friendês girlfriend who insists on telling every girl you meet that your nickname was –Scooter” in high school, Chavez is now a total Johnson block.  The only good news here is Chavez probably wonêt be healthy for more than 50 games.""  And that's me quoting me!  I was shining up a Chris Johnson sleeper post prior to the Chavez signing.  I think Johnson can still get 140 games played and have a solid season, especially for NL-Only leagues.  He would've been up near the 15th ranked guy if it wasn't for Chavez, so I like him as a flyer.  In 44 games with the D'Backs, he had 7 homers, and he hit 4 homers and .245 vs. lefties last year, but 11 homers and .295 vs. righties, which makes him puzzling, to say the least, as a platoon partner with Chavez."242,Juan,Francisco,,3B,39,16,58,0.251,2,,,,,,,"I'll probably write a sleeper post about Juan Francisco.  Yes, I left my heart in Juan Francisco.  His major drawback is the Braves are set to platoon him.  Okay, that's a pretty big drawback.  If he weren't platooned, I'd give him the line of 60/25/78/.248/3.  In a platoon..."243,Joel,Hanrahan,,RP,,,,,,3,4,3.89,1.33,62,33,244,Grant,Balfour,,RP,,,,,,4,1,3.54,1.07,69,29,245,Chris,Perez,,RP,,,,,,2,4,3.19,1.16,57,37,246,Lance,Lynn,,"SP, RP",,,,,,7,6,3.81,1.29,142,0,"I do these posts by writing out all the names, then I rank them, then I add in the blurbs and projections.  Sometimes I'll write a name and next to it I'll put a note to remember for later when writing the blurbs.  The note next to Lynn read, ""Check to see if he's in the rotation.""  The Cards have Carpenter, Wainwright, Jaime Garcia, Westbrook and then... Lynn?  Miller?  Joe Kelly?  Garcia will probably be hurt most of 2013 and why he hasn't been ranked yet.  So that moves Miller into the rotation with Lynn, right?  I'm not sure.  The Cardinals seemed to like Lynn in the bullpen and, other than the big splash to open the season, Lynn wasn't great as a starter.  With Lynn, I have a feeling I just ranked my first middle reliever."247,Shaun,Marcum,,SP,,,,,,9,7,3.84,1.29,145,0,"Missed a large portion of 2012 due to elbow tightness and when he returned his velocity wasn't there.  Hey, maybe he can star in the stage adaption of, ""No Velocity for Old Men."""248,Ryan,Doumit,,"C, OF",44,15,62,0.268,0,,,,,,,"This is a new tier.  This tier goes from here until Iannetta.  I call this tier, ""Draft these guys so you can drop them the first week of the season for the hot catcher off of waivers.""  Here's you, ""Yo, Grey, you sexy beast, question:  should I drop Doumit for John Jaso?""  Me, ""The season hasn't started yet.""  ""I know, Holmes, I ain't a complete moron.""  ""You drafted Doumit and you want to drop him already.""  ""I see your point.  How about dropping Doumit for A.J. Ellis?"""249,Jarrod,Saltalamacchia,,C,38,17,53,0.217,0,,,,,,,"Salty's the kind of guy I would normally like, but the Red Sox might have Napoli, David Ross and a lurking Ryan Lavarnway.  Salty better throw his little brother over his shoulder for some good luck, otherwise he's looking at a huge decrease in playing time, especially with his contact rates."250,A.J.,Ellis,,C,45,9,51,0.264,0,,,,,,,"No relation to Doc Ellis, but you might be on LSD if you draft him.¾"251,Russell,Martin,,C,44,14,58,0.239,5,,,,,,,He agreed to a two-year deal this offseason with the Pirates after he heard the one city Alyssa Milano would never visit is Pittsburgh.252,Angel,Pagan,,OF,85,7,52,0.272,26,,,,,,,"All this time I thought his name sounded like a new Dan Brown book, but I just realized something.  Angel Pagan is the nickname Tupac would've given himself had he lived.  There's no way I can pay you back but the plan is to show you that I understand, he's an Angel... Give the crack to the kids who the hell cares?  One less hungry mouth on the welfare, he's a Pagan..."253,Michael,Brantley,,OF,83,7,57,0.292,20,,,,,,,"From all the names in this tier, Brantley is the most intriguing.  Sure, when you're in a tier of Pagan, De Aza, Melky and Saunders, being the most intriguing is like being the world tallest dwarf.  Brantley hasn't shown any speed yet in the majors like he did in the minors.  One year in Triple-A, he swiped 46 bases with only 5 times caught.  So how on earth did he only steal 12 bases last year with 9 times caught?  I don't have a clue, Professor Plum, but it makes me think he could have a big, surprising year."254,Melky,Cabrera,,OF,90,9,69,0.265,15,,,,,,,"When he signed with the Blue Jays, I didn't write anything about him.¾ But here's what I found on the internet from a site called whymelkyissofreakinawesome.com, ""Last year, Melky was suspended for 50 games for drugs that weren't really that illegal.¾ I've taken the same drugs as Melky and they did nothing for me.¾ I think they actually made me a bit lethargic. I bet without these drugs, that are again barely illegal, Melky could have the best season of his career.¾ If I were a major league team, I'd sign him in a heartbeat.¾ (Updated:¾ Melky was signed by the Blue Jays and is probably very appreciative.¾ I don't know; I am not him.¾ He is also wondering if the drugs he took before that didn't help him are legal in Canada.¾ If anyone knows, ping me in the comments and I'll pass along the info to Melky, though I am in no way associated with him.)""¾ Not sure of the accuracy of that site, and all correspondence sent to the website administrator, Fakey Boobrera, went unanswered."255,Cameron,Maybin,,OF,78,9,52,0.257,28,,,,,,,"In 2011, Maybin stole 40 bases and hit .264.  In 2012, he stole 26 bases and hit .243.  That difference made him a top 30 overall outfielder to a waiver wire guy.  Well, I'm here to tell you -- and I am here -- last year he was unlucky with BABIP and should hit closer to .260.  Extra times on base and his steals should go up.  He'll only be 26 years old this year, so there's really no reason to doubt his ability to bounce back.  Why is he ranked so low then?  Cause in a good year, he's still only going to hit .265 and less than ten homers."256,Coco,Crisp,,OF,68,8,44,0.272,35,,,,,,,You know what Coco Crisp is good for?  SAGNOF and a balanced breakfast.  Cerealiously.  257,Leonys,Martin,,OF,85,12,50,0.28,17,,,,,,,"I already went over my <a href=""http://razzball.com/leonys-martin-2013-fantasy-outlook/"">Leonys Martin 2013 fantasy</a>.  I wrote it in umeboshi plum-colored lipstick. "258,Lorenzo,Cain,,OF,77,17,54,0.272,20,,,,,,,"On top of the potent (not terrible?) Royals lineup is Cain.  The Tongan who's good with balancing a checkbook, Irving Falu, and the chicken man, Jarrod Dyson, are there to step in when Cain once again fails to live up to expectations and gets hurt.  Seriously, I could just link to my Cain sleeper post from last year.  It still applies.  It just needs a giant asterisk.  It actually it's just a giant healthrisk."259,Colby,Rasmus,,OF,69,21,74,0.242,8,,,,,,,"I'm half expecting Blue Jays fans to be chanting ""Let the Gose loose"" by the All-Star break, forcing Rasmus to the bench.  I also could see Rasmus hitting for more power than other guys in this tier.  But he also won't steal as many bases or hit for a terrific average without luck.  The good news if you don't draft him.  This will be the last time he'll be ranked anywhere if he disappoints again, more because he won't have a starting job anywhere."260,Alfonso,Soriano,,OF,54,23,74,0.254,5,,,,,,,"This is a new tier.  This tier goes from here until Ross.  I call this tier, ""Your grandfather's younger brother's fantasy outfield.""  The projections for this tier will more than likely be better than the next tier.  The names are more familiar.  But when you're this deep into the outfielders, you're better off taking a flyer on upside.  So let someone else grab Soriano and jump to Da-da-da-dayan, as they sing at any Passover Seder worth its salt.  Soriano had a huge bounce back year in 2012.  That's cool.  Jump in your DeLorean, go back to March 2012 and draft him.  And, while back there, tell Kanye not to date Kim and listen to his own lyrics, ""She was suppose to buy your shorty Tyco with your money, she went to the doctor got lypo with your money, she walking around looking like Michael with your money."" "261,Ryan,Ludwick,,OF,57,24,77,0.267,1,,,,,,,"When he re-signed with the Reds, here's what I said, ""Across the board, 2009 looks to be Ludwickês true talent level:  63/22/97/.265/4.  Heês nowhere near the 37-homer guy that he was in 2008, and heês not as bad as the Petco-fueled 13-homer, .237-hitting guy in 2011 when it looked like Ludwick was decomposing.  (pun point!)  Last year, he went 53/26/80/.275 in Great American.  Depending on where he bats in the order (I have my arthritic fingers firmly crossed that Frazier bats clean-up), Ludwick should be good for around those stats again.""  And that's me quoting me!"262,Rafael,Betancourt,,RP,,,,,,3,4,3.27,1.1,59,32,263,Jason,Grilli,,RP,,,,,,2,4,2.34,1.12,54,30,264,Ryan,Madson,,RP,,,,,,2,1,3.9,1.24,54,30,265,Matt,Harrison,,SP,,,,,,13,10,3.88,1.29,130,0,"He took the biggest dive from the end of the season rankings to here, and the Rangers didn't play one game, unless you count the game of chicken they played with Hamilton and lost.  Last year, Harrison had 18 wins and a 3.29 ERA with a 4.13 xFIP (nah, that ain't lucky).  Hereês my theory:  George Harrison did all that touchy-feely singing about My Sweet Lord and Hare Krishna, but since George is no longer with us, thereês some leftover karma floating around the universe for a Harrison, so Matt was the recipient of said karma.  Or not.  Just a theory!  Also, Harrison gets no Ks whatsoever.  He'll be a matchups starter vs. the Mariners and in interleague. "266,James,McDonald,,SP,,,,,,10,9,4.01,1.28,155,0,"His first and 2nd half were night and day, Al B. Sure.  His pre-All-Star break 2.37 ERA was sixth best in the majors and his 0.97 WHIP was seventh best.  His 2nd half was the worst thing God ever spit up.  Due to BABIP, he wasn't that good in the 1st half or that bad in the 2nd half.  So you throw out the good, and you throw out the bad and you got The Facts of the Averagest Pitcher, The Facts of the Averagest Pitcher... If you sing that about 200 times, it gets catchy.  Trust me."267,Tim,Hudson,,SP,,,,,,12,7,3.9,1.24,100,0,"He's gonna be 38 years old this year, which in pitcher years is 38 (years don't change for pitchers; that's for dogs, silly).  Now 38 years in his arm's age is... Well, that's the same too.  Tim Hudson is so old... He makes references to The Addams Groove, the MC Hammer/Vanilla Ice super-collaboration, in conversation and expects people to remember it.   Tim Hudson is so old.... He eats Nerds candy made from wax manufactured by Benjamin Franklin.  Tim Hudson is so old.... He farts dust."268,Jason,Kubel,,OF,62,22,81,0.248,1,,,,,,,"It was a tough call deciding if Kubel or Ross should be ranked here.  All hundred of my monkeys that type up these rankings fretted for many bananas... Hours, Ling-Ling, hours?!  Not bananas!"269,Chris,Iannetta,,C,40,15,53,0.246,1,,,,,,,"The good news for Iannetta last year is he figured out early on that if you want to catch games for Scioscia, you can't be good offensively.  That's the bad news too."270,Lonnie,Chisenhall,,3B,59,16,79,0.253,3,,,,,,,"He's all ready for the breakout, or so everyone thought two years ago, then bupkis.¾ Chisenhall should be the starting 3rd baseman, but Aviles is lurking there to step in and prospblock at any point.¾ Also, Jonny Gomes's brother, Yan, might step in to steal some 3rd base ABs.¾ Chisenhall is hideous vs. lefties.¾ In his career vs. the ones that can't use the regular scissors, he's hitting .227 in 88 ABs.¾ If the Indians go to a Lonnie/Yannie platoon, it'll kill both of their values."271,Josh,Donaldson,,3B,58,16,68,0.258,4,,,,,,,"He couldn't even stick with the A's last year, hitting .153 through his first 28 games.¾ From April to June, he had one walk.¾ He couldn't hit the ball even if he was swinging with his dad Sam Donaldson's eyebrows.¾ When he returned, he looked like a new man, hitting .290 with 8 homers in 176 2nd half ABs.¾ His September (4 homers, .257 in 101 ABs) looks repeatable.¾ Unfortunately, I'm not convinced his April through June aren't repeatable, as well."272,Ian,Stewart,,3B,42,17,54,0.239,4,,,,,,,"I didn't nickname Stewart Mini Mini Donkey without serious donkey-introspection.¾ I touched my inner donkey, which is illegal in Singapore, and sprayed donkey juice all over Stewart, which is illegal in 49 of 50 states -- thanks, Vermont, for hearing me out!¾ Like Reynolds and Dunn (when they were younger), Stewart could hit bombs, steal some bases and hit for a terrible average.¾ Now Stewart looks like he might be lucky to get ten homers, a .220 average and a full season of at-bats."273,Gordon,Beckham,,2B,72,19,68,0.259,5,,,,,,,"Last year, he cut his strikeout rate and raised his walk rate.  When correcting for luck, he hit .264 (not .234), had a career high in power, and he's burned everyone at least once in the last three years.  That last bit is probably the only thing stopping you from drafting him.  It is a fairly large thing though.  I know, I've been saddled with him in the past too.  I'm expecting another step forward as he is just 26 years old, but there's a bunch of risk involved."274,J.J.,Hardy,,SS,68,20,79,0.244,0,,,,,,,"The biggest mystery was how the Orioles succeeded last year with the bulk of the two-hole at-bats going to Jimmy Juniper Hardy.  Hardy even tried to solve that mystery by putting up a .282 OBP on the season.  I have to believe someone in the Orioles organization will come to their senses and move Hardy down in batting order.  Jimmy Juniper is a six to seven hole hitter, and not a great one at that."275,Alexei,Ramirez,,SS,66,12,70,0.259,12,,,,,,,"If you take his best power year (21 homers in 2008) and his best steals year (20 last year) and put them together, you have a guy that was good five years ago and degrees of yawnstipating since.  Last year, he had the worst walk rate (2.6%) for any player who qualified for the batting title since 2009, or more like ""who qualified for the batting title, but obviously came nowhere close to winning it.""  That was the worst walk rate with 620+ plate appearances since Luis Guzman's brother, Cristian in 2002."276,Cody,Ross,,OF,78,22,58,0.26,3,,,,,,,"Here's an overheard conversation the Diamondbacks' front office had this offseason, ""Guys and one girl we hired out of our binder, we've looked over all the data and it says we should trade our best player, Justin Upton-- Yes, Tomas?""  Tomas, ""Sir, our supercomputer actually says don't trade Justin Upton.""  ""Good, because no one wanted him.  Next this no-human-brains-needed supercomputer told us to trade our best pitching prospect, Trevor-- Yes, Tomas?""  ""Actually, it no longer says that.""  ""Crap.  I told you to update that computer back in November.""  ""Sorry, sir, I read some bad reviews about the new Windows supercomputer operating system.""  ""Well, what does it say to do with this team?""  ""It says we should acquire another player that is exactly like Jason Kubel.""  ""But the Reds already signed Ryan Ludwick.""  ""Hmm... Maybe Cody Ross is a good 2nd option.""  ""The seamstress?"""277,Dayan,Viciedo,,OF,60,22,72,0.249,1,,,,,,,"This is a new tier.  This tier goes from here until Mayberry Jr.  This tier is called, ""Well, we're pretty deep here, how much upside were you expecting?""  Let's get the bad stuff out of the way first.  Viciedo only had a 31.3% FB rate (around that of Jemile Weeks); he had a 16.4% infield fly ball rate (7th worst in the majors, around guys like Uggla and Carlos Pena, i.e., it's not easy to hit for a decent average when you're popping up everything); he had a 20.5% HR/FB rate, which is high and... Wait, are there any positives here?  Well, as the tier name said... We are deep."278,Domonic,Brown,,OF,64,15,73,0.262,9,,,,,,,"I don't think Charlie Manuel will ever give Domonic Brown an everyday job for a full year, but Manuel did say, ""Sassafrass my crickets!  Has some lunkhead been eating my special ju-ju straws?""  I have no idea what that means, but Brown should start every day."279,John,Mayberry Jr.,,"OF, 1B",59,18,78,0.251,2,,,,,,,"I imagine there will be a time in the near future when I'm telling everyone to pick up Mayberry.  Then a time in the near future after that near future when I'm telling everyone to drop Mayberry.  Then a time in the near future after that second near future when I'm telling everyone there was a time in the near past that you shouldn't have dropped him, but now's the time to pick him up again."280,Brandon,Moss,,"1B, OF",45,19,58,0.255,2,,,,,,,"Chris Carter is Ryan Howard in a young man's body but can only hit lefties... Brandon Moss is a non-descript white man but can only hit righties... Together they are... The Fantasy Platoon!  In a world like you've never seen before... One man's quest to build a perfect 1st baseman leads him through trial and error to start one man versus...LEFTIES!  Another man versus... RIGHTIES!  Those in daily leagues prosper by swapping guys out depending on their... OPPONENT!  Until they realize they are really brothers and have to drive cross country with Barbara Streisand.  ""Oy, Brandon, it's hot.  Are the windows open?""  Hijinks!  Pratfalls!  Home runs!"281,Krispie,Young,,OF,31,17,42,0.262,9,,,,,,,"On one hand, it doesn't make any sense to bench a 25/25 guy against righties.  On the other hand, Billy Beane's new OBP is platooning.  On the third lesser known hand that is actually a Venus Fly Trap dressed up for Halloween, if Young only faces lefties his counting stats are going to take a huge hit but his average might be about normal.  In 394 ABs vs. lefties in his career, he has 20 homers and a .272 average."282,Kyle,Lohse,,SP,,,,,,9,12,4.09,1.29,130,0,"Member what I said about Harrison about 567 words ago (I counted; thanks, OCD!)?  Lohse now takes the title of dropping the most from the end of the season to preseason rankings.  Lohse is exactly the kind of starter I would never draft.  I'm obviously not alone as he still didn't have any offers to sign as of mid-January.  ""I'm calling on Kyle Lohse's behalf and he wants you to know he would happily sign with the Diamondbacks.""  Kevin Towers, ""Kyle, is this you calling again?""  *20 second pause*  ""Kyle, I hear you breathing."""283,Addison,Reed,,RP,,,,,,4,3,3.9,1.28,52,27,284,Brandon,League,,RP,,,,,,1,4,3.89,1.28,49,17,285,David,Robertson,,RP,,,,,,4,5,2.23,1.13,100,7,286,Bud,Norris,,SP,,,,,,8,10,3.9,1.33,190,0,"This is a new tier.  This tier goes from here until the top 100 starters for 2013 fantasy baseball.  I call this tier, ""Schoolboy Q and Kendrick Lamar."" They are the new crop of rappers you should be listening to.  Download <a href=""http://www.amazon.com/gp/product/B008Z94NZG/ref=as_li_ss_tl?ie=UTF8&amp;tag=razzball07-20&amp;linkCode=as2&amp;camp=1789&amp;creative=390957&amp;creativeASIN=B008Z94NZG"" target=""_blank"">Good Kid M.A.A.D. City</a> and <a href=""http://www.amazon.com/gp/product/B006X9GEW0/ref=as_li_ss_tl?ie=UTF8&amp;tag=razzball07-20&amp;linkCode=as2&amp;camp=1789&amp;creative=390957&amp;creativeASIN=B006X9GEW0"" target=""_blank"">Habits &amp; Contradictions</a>, in that order.  If you only want one song from either album, download Lamar's B*tch Don't Kill My Vibe.  (The asterisk is replacing a U.  The song is about Butch Patrick.)  If you ask the populace, they'll all know Kanye and Jay-Z, they might not know these two.  Then Schoolboy Q or Kendrick will come out with another album this year and suddenly everyone will know them or they'll disappoint and fall back to obscurity.  That's the guys in this tier.  They all have a chance to blow up in the good way or in the bad way.  Someone from this late in the rankings has to way outperform preseason projections.  It happens every year.  It could be Norris.  It could be any of these guys.  Norris's xFIP last year was 4.12, year before it was 3.73, 3.96 in 2010.  Last year he had the best K-rate of his career.  If he can actually throw 200 IP for the first time in his career (at 28 years old it shouldn't be impossible), he could have his first 200 K season and a sub-4 ERA.  All he needs to do is shave a half walk off his 3.53 BB/9 from last year.  That won't be easy, but doable.  Bud, don't kill my vibe! "287,Jason,Hammel,,SP,,,,,,10,11,3.67,1.26,175,0,"For full disclosure, I almost ranked Hammel about 35 spots higher.  I really like him.  Then I got to thinking, which is something I try to avoid, and I know that you can wait until the last round to draft Hammel, there's no reason to rank him higher.  Last year, he threw his fastball almost a mile per hour faster (93.6) and forced a ton more ground balls.  Assuming his knee is fine (he wasn't 100% confident in October), get him."288,Dylan,Bundy,,SP,,,,,,8,3,3.4,1.1,150,0,"I already went over my <a href=""http://razzball.com/dylan-bundy-2013-fantasy-outlook/"">Dylan Bundy 2013 fantasy</a>.  I wrote it while watching the Michael Jordan plays baseball 30 for 30.  What a waste of an hour that was.  Way to phone it in, Ron Shelton.  No one's green-lighting the sequel, White Men Still Can't Jump, with that kind of effort."289,Shelby,Miller,,SP,,,,,,10,4,3.63,1.27,155,0,"I already went over my <a href=""http://razzball.com/shelby-miller-2013-fantasy-outlook/"">Shelby Miller 2013 fantasy</a>.  I dictated it from what I heard after I put a seashell to my ear."290,Andrew,Cashner,,"SP, RP",,,,,,6,7,3.35,1.24,100,0,"He's already had his first setback of the season and the season is two months away.  He'll start the year on the DL and won't return until the end of April.  He probably won't start more than fifteen games all year, but I'll still grab him because of his upside.  I draft Cashner for the hell of it, just for the yell I get... Mmm mmm mmm, for the smell of it!"291,Kyle,Kendrick,,SP,,,,,,12,10,3.72,1.25,130,0,"This tier started in the top 80 starters for 2013 fantasy baseball.  This tier goes from here until Teheran.  I called this tier, ""Schoolboy Q and Kendrick Lamar.""  Kendrick's a tough guy (Kyle, not Lamar) to draft due to Charlie Manuel's use of him.  ""Kendrick, go get Pa some straw, I needs to be chewing before the rooster come-a-callin'!""  Five years ago the Phils pegged Kendrick to be a starter.  Five years later he's still bouncing between the bullpen and the rotation.  If I was 100% sure he'd be a starter all year, I would've ranked him about 30 spots higher.  I like Kendrick.  It's more about whether or not the Phillies like him."292,Hisashi,Iwakuma,,SP,,,,,,9,12,3.56,1.26,152,0,"His 2012 numbers were: 3.16/1.28 and a 7.25 K-rate, which is nice.  Want it to be nicer?  Of course you do, you greedy SOB.  As a starter, his ERA was 2.65 and his WHIP was 1.23.  This year there shouldn't be any bouncing between bullpen and rotation.  Not if I can help it (I can't).  I could've also ranked Erasmo Ramirez here.  Their projections are similar.  If nothing else, both will make nice <a href=""http://razzball.com/fantasy-baseball-terms/#Marginer"">Marginers</a>.  Jason Vargas who?!  <em>He's an ex-Mariners pitcher who pitched well at home and not so great on the road.  He's now on the Angels.</em>  I know, Random Italicized Voice.  <em>I figured, since you were the one that told me about Vargas's trade.</em>  Okay, can I move on?  <em>Who's stopping you?</em> "293,Derek,Norris,,C,42,13,60,0.205,7,,,,,,,"Loud Voice, ""He could hit 15 homers and steal 10 bases!""  Quiet Voice, ""And hit .190.""  "294,Tyler,Flowers,,C,40,14,52,0.2,3,,,,,,,"Last year in 253 plate appearances, he had a 36.6 % strikeout rate.  If he qualified for the batting title, that would've been the worst strikeout rate of any hitter since 1900 when ""No-Eyes"" Buck Winston struckout 587 times in 588 at-bats.  Though, the record was removed from the books the next year when baseball required eyes.  Ironically, his one hit was a seeing-eye single up the middle."295,Jedd,Gyorko,,2B,60,18,70,0.265,4,,,,,,,"If there's a Jedd in the Padres plans, then that will affect Forsythe and his projections.  Right now, it's not clear how their 2nd base slot will play out.  I went over my <a href=""http://razzball.com/jedd-gyorko-2013-fantasy-outlook/"">Jedd Gyorko fantasy</a>.  He does it like this, he does it like that, he does it like this with a baseball bat..."296,Logan,Forsythe,,2B,82,8,45,0.278,12,,,,,,,"Logan's run could end, and Jedd Gyorko might get a chance (I get to him in a moment).  If Logan's run continues, they'll rename it Hunger Games and cast Josh Hutcherson.  2013 Projections:  82/8/45/.278/12 (NOTE: if Logan approaches anywhere near these projections, then Gyorko's not playing and vice versa for his projections below.)"