Rank,First Name,Last Name,Team,Position(s),Runs,Home Runs,RBIs,Average,Steals,Wins,Losses,ERA,WHIP,Strikeouts,Saves,Blurb1,Miguel,Cabrera,,3B,110,39,124,0.327,3,,,,,,,"To those that donêt know (and none of you do), I recently moved.¾ Only about five minutes from where I used to be, so weêll be sure to stay in touch!¾ So, in my new place, Iêve decided to decorate.¾ Iêm going to hire a bunch of different artists to do portraits of me.¾ It will be up to them how they want to portray me.¾ If they simply want to focus on my mustache, then thatês their call.¾ I hope one asks to do a nude portrait of me with nothing but a serpent covering up my naughty bits.¾ I tell you this now, because I have nothing to say for Swiggy.¾ He was just the first Triple Crown winner since Yaz in 1967. ¾ Heês awesome.¾ You donêt know this already?¾ This is the first tier.¾ This tier goes from here until Mike Trout.¾ I call this tier, –Miggyês going to a picnic and heês bringing the best for fantasy baseball.”"2,Ryan,Braun,,OF,105,34,116,0.319,22,,,,,,,"The top guy is someone who has struggled with alcohol, the second is a guy who was nearly suspended for drugs and the fourth guy made you feel like you were high.¾ Itês just like the golden days of baseball when Babe Ruth and Fatty Arbuckle were unscrewing their Coke bottles with vaginas and Ty Cobb was smoking opium with Eleanor Roosevelt and her lesbian friends.¾ (This is all according to J. Edgar Hooverês secret files, so your –truth mileage” may vary.)¾ I could see Braun number one and Miggy number two, but I went with them this way because of position eligibility and I get worried that any year now Braun is going to revert to being a 15-steal guy rather than a 30-steal guy."3,Andrew,McCutchen,,OF,102,30,107,0.295,27,,,,,,,"And just like that, my first curveball!  Due to this ranking, I plan on owning McCutchen in every league.  Unlike Braun and Miggy, The Dread Pirate is actually entering his prime.  Sure, his runs and RBIs might be a tad wonky due to the Pirates.  Clint Barmes can only do so much!  Or maybe that sentence meant to read, Clint Barmes can only do nothing.  Neverthehoo!  McCutchen has the speed to steal more than 20 bags, but he does need to figure out how to use said speed -- his caught stealing percentage isn't terrific.  I looked at our <a href=""http://razzball.com/playerrater/"" rel=""nofollow"">Player Rater</a> from last year and I tried to figure out one guy that could be better this year after a top ten year in twenty after twelve.  McCutchen was the only one I saw.  The only trick will be him keeping his average above .290."4,Mike,Trout,,OF,108,19,102,0.326,48,,,,,,,"Iêve read a lot about how Trout just had a rookie year that we may never see again from a rookie.¾ Ainêt that right, boo?¾ True.¾ Something people are not saying is that we may never see another year like that from Trout.¾ His highest homer output in any pro season before was in Double-A when he hit 11 homers.¾ Granted, it was only in 91 games, but still.¾ Before he was called up, he only had one homer in Triple-A last year in 20 games.¾ His May, when he hit 5 homers and had a 15.6% HR/FB, looks doable.¾ His June with 3 homers and a 12.5% HR/FB is easy for him.¾ Like Trout shooting his kinfolk in a barrel.¾ His July with 10 homers and a 31.3% HR/FB is silly.¾ If he hits 41% fly balls all year as he did in July, heês not going to hit 60 homers on the year.¾ What he will do is hit 25 homers and .270 or lower.¾ In 40 games in 2011 when he hit 40% fly balls, he hit .220.¾ He has top echelon speed.¾ He needs to hit line drives and ground balls with the occasional home run.¾ The 49 steals donêt look like a fluke.¾ Heês the fastest white boy Iêve seen since Jason Mewes stopped doing crank.¾ A 20-ish homer, 50-ish steal season is still very valuable."5,Robinson,Cano,,2B,105,30,110,0.31,4,,,,,,,"This is a new tier.¾ This tier goes from here until Votto.¾ I call this tier, –This tier might not leave you in titters, but no one says titters who was born after 1912 so it doesnêt matter.” After drafting Cano (and other players in this tier), you may not find yourself lighting a cigarette and talking about how you never saw fireworks in the shape of watermelons before.¾ This tier is my attempt to add some stability into the top ten.¾ Some fantasy baseball •perts may try and add some –excitement” into their top ten with Buster Posey or Adrian Beltre.¾ These same •perts probably had Jacoby Ellsbury in their top ten last year.¾ Excitement is great if itês not going to cost you your fantasy season.¾ If Cano has a bad season, he gets 28 homers, 100 runs, and 110 RBIs.¾ If Cano has a good season, he gets 32 homers, 110 runs and 120 RBIs.¾ Since 2nd base is hella shallow, as the kids would say in 2002, Iêll take reliable 30-ish homer power from Cano fifth."6,Albert,Pujols,,1B,103,32,112,0.297,7,,,,,,,"Youêre not going to get a more miserable month from Pujols than what you got last April.¾ In his first 92 ABs of the season, he had zero homers, 4 RBIs and a .217 average.¾ And he still finished in the top 25 overall with 30 homers, 105 RBIs and a .285 average.¾ So, if he hits .250 with 3 homers in April, we donêt even blink twice about drafting Pujols.¾ BTW, if you can blink your Pujols even once, seek medical attention."7,Prince,Fielder,,1B,94,39,117,0.291,1,,,,,,,"His even/odd homer years continued in 2012.¾ In even years, his homers have been 28, 34, 32, 30.¾ In odd years:¾ 50, 46, 38.¾ Unless your Garfield desk calender is in Jewish years, and youêre like, –Yo, happy 5773, Schlomo” itês pretty clear weêre about to have a huge year from Prince.¾ Now, even if this fairly anecdotal reasoning doesnêt hold up, Prince is still good for 30 homers and nice counting stats."8,Joey,Votto,,1B,104,25,110,0.32,5,,,,,,,"Votto could be in a sub-section of this tier, if making a sub-section of make-believe tiers on a fantasy baseball blog didnêt scream someone needs a new hobby.¾ Sure, Votto didnêt have a huge 2012, but that was due to an injury. ¾Will he have a problem moving forward in 2013?¾ Maybe, but thatês why God invented running backwards. ¾Votto did admit that his knee was an issue for him down the stretch when he didnêt hit a homer in his last five weeks after he returned.¾ Heês 29 years old and should be fine with the offseason rest.¾ Even if he canêt power balls out at a 30+ homer pace, heês a virtual lock for 100 runs, 100 RBIs, and a .320 average in a full season of at-bats.¾ Iêll take 25 homers with that."9,Giancarlo,Stanton,,OF,92,45,110,0.277,7,,,,,,,"This is a new tier.¾ This tier goes from here into the top 20 for 2013 fantasy baseball.¾ I call this tier, –I really like these guys.¾ Question marks be damned.”¾ Member how I said at the beginning of the last tier that you should go with safe even if it means less than exciting?¾ Well, Giancarlo and Upton may be exciting, but theyêre also safer than you think.¾ Iêll explain.¾ Early on in 2012, hereês a few of things said on this blog in the comments.¾ –Grey, you really think Ryan Braun can produce without Prince Fielder in the lineup?¾ BTW, is your avatar actual size?”¾ I said, yes and yes.¾ Also heard last year, –Iêm not touching McCutchen because of that lineup.¾ Iêd much rather Giancarlo or Hanley.¾ Their lineup is stacked.¾ Now, do you apply John Frieda Extra-Sheen Mustache Conditioner before or after you shower?”¾ Hereês the thing, and thing is pretty big.¾ Thatês what she said!¾ Huh?¾ The thing is, you donêt know what is going to happen with runs and RBIs beyond a clean-up hitter should get around 100-something RBIs and 90-something runs.¾ Maybe Juan Pierre will decide to steal 2nd 70 times and Giancarlo will knock in 120 RBIs.¾ Maybe Giancarlo will hit 45 solo homers and only score 52 runs all year.¾ Maybe they take down the center field sculpture of unicorn vomit, realize that was actually blocking a jetstream and Stanton hits 70 homers.¾ Maybe the dude who wrote up the Mayan calender in 12,000 B.C. had sloppy handwriting and meant 2013 for the apocalypse.¾ Forget maybes.¾ Stanton will hit 40+ homers, steal 7 bases and hit .275.¾ Let the counting stats figure themselves out."10,Justin,Upton,,OF,105,28,92,0.282,21,,,,,,,"Last year, he had the worst season you can imagine for him.¾ Unless your imagination also includes dwarfs.¾ That season was still 107/17/67/.280/18.¾ That was with a career low HR/FB%, which was coupled by a thumb injury that he needed fluid drained from in April.¾ He played through the injury, but not until August did it really start to feel better.¾ How do I know this?¾ He hit nine homers in August and September combined.¾ In the four months combined before that, he hit 8 homers.¾ In September alone, he hit 6 homers and .301.¾ Further, he was playing with a pad around his thumb for the majority of last season.¾ His thumb felt good enough in August to remove the pad.¾ When he removed the pad, he hit eight homers in his final 36 games.¾ Donêt make me say it again.¾ Okay, one more time.¾ He hit 8 homers in 36 games when his thumb finally was healed.¾ If you wanna draft for 2012, then draft Edwin Encarnacion.¾ If you wanna draft for 2013, draft Justin Upton.¾ Albright out."11,Carlos,Gonzalez,,OF,100,28,102,0.307,19,,,,,,,"This tier started in the top 10 for 2013 fantasy baseball.  This tier ends at Jones.  I call this tier, –I really like these guys.  Question marks be damned.”  I could have also called this tier, –Iêm hoping for big things from guys in the prime of their career, previous setbacks be damned.”  Previous Setbacks, –Well, damn you right back!”  CarGo doesnêt stay healthy for whole seasons, but heês still only 27 years old.  Heês good for 135 games and a 20/20 season.  The rest of it is icing on the cake.  Hereês hoping for a season with a lot of icing and his owners needing their insulin."12,Evan,Longoria,,3B,89,32,107,0.283,5,,,,,,,"Like Baby Jessica, eventually we have to stop going to this well.  I'll be the first to admit that if Longoria has a poor season in 2013, he's gonna fall far in 2014, like, six to seven rounds later.  Still, I refuse to write off a 27-year-old with MVP potential.  He wasn't bad last year.  He was hurt.  I know, over-the-internet friend.  He's always hurt.  As late as November, he had an operation on his hamstring, the same hammy that plagued him last year.  He says he's fine now.  He just needs to stay healthy.  That is the only thing stopping him.  If you prorate his 2012 over a full year, he had a solid year.  A 32-homer, 100+ RBI, .285 season.  3rd base is a wasteland after the top eight, and even some of those (Wright, Hanley, Headley, Zimmerman, Aramis) aren't without their question marks.  Beltre was conspicuously absent from that list, but I'll get to him quicker than you can say, ""You have Longoria above Beltre?!""  As I said in my <a href=""http://razzball.com/todd-frazier-2013-fantasy-sleeper/"">Todd Frazier sleeper</a> post, there's a lot of late, terrible 3rd basemen.  If you're gambling on Hanley bouncing back, that's a different problem.  If you're gambling on Aramis not emitting a stank smell, that's a different issue.  If you're gambling on Zimmerman and Headley, they're a whole set of other problems.  I'll take the gamble on Longoria's health first.  Now if he's having hamstring issues in the spring... Well, we'll cross that bridge when we come to it, presumably on crutches."13,Adam,Jones,,OF,90,34,100,0.284,15,,,,,,,"I almost put Jones in the top ten and Justin Upton here.  I lurve 27-year-old hitters entering their prime.  Big time lurve.  My lurve doesn't have a painting of the Mona Lisa, it has a painting of Adam Jones.  Here's what we know for absolutely sure.  Over the past two seasons, he's averaging 28 homers, 14 steals, .284 average and 156 games.  He is now in the prime of his career.  Even if we only got an ""average"" year from him, you have a number one outfielder.  There's no weird injury issues.  He had a flukey wrist injury in June and his power was zapped for two-plus months.  In September, his power returned with six homers for the month.  No odd spikes in K-rate or ground balls or BABIP.  His line drive rate went up last year and, when he hit homers, only six of them were ""Just Enough"" out of 32.  The only thing that hurt his value last year were his 82 RBIs.  You and I -- hey, pal! -- both know that RBIs have nothing to do with him."14,Matt,Kemp,,OF,88,25,100,0.294,19,,,,,,,"This is a new tier.  This tier goes from here until A-Gon.  I call this tier, ""Eff me in the coolie, why do I have so many concerns this early?!""  Kemp couldn't swing a bat until January due to a shoulder injury after he had surgery in October to reattach his labrum.  Here I thought reattaching a labrum was something you'd hear about in a Breaking Amish reunion special.  After the surgery, Kemp said, ""I was definitely surprised and disappointed.""  &lt;sarcastic&gt;This sounds awesome!&lt;/sarcastic&gt; I think he'll probably be his old-new-old self by late-May, and wouldn't be surprised to see him put up numbers similar to last year.  Unfortunately, his numbers last year were solid, but not spectacular.  It's a bit sucky that I'm going to miss out on his special brand of speed/power/handsomeness, but, with where I have him ranked, I probably won't be owning him in 2013."15,Josh,Hamilton,,OF,92,29,109,0.277,7,,,,,,,"I went over my <a href=""http://razzball.com/la-sick-of-just-angels-in-the-outfield/"">Josh Hamilton 2013 fantasy</a> when he signed with the Angels.  I wrote it while counting Arte Moreno's checkbook zeroes."16,Adrian,Beltre,,3B,82,28,103,0.281,2,,,,,,,"The argument against my ranking of Beltre vs. Longoria is obvious.  I am counting on a guy with burgeoning skills but health problems rather than a guy who looks like he could decline, but has been terrific the last two years.  I'm going with the injury risk over the guy who will be 34 years old on April 7th.  Beltre is admittedly a tough call for a few reasons.  His Texas home run per fly ball rates are above his career average, but he's also in Arlington and not Dodger Stadium or Safeco.  He has been injured in the past, but one was of the <a href=""http://razzball.com/fantasy-baseball-terms/#Jockular_Sphincteritis"">Jockular Sphincteritis</a> variety when a ball clipped his testicles, which sounds like an injury that would happen to a labradoodle.  Stop licking your wound!  That injury was of no fault of his (if it was his fault, he should see a shrink), so it's a bit too fluky to say he's injury-prone.  Also, care of <a href=""http://baseballheatmaps.com/"" target=""_blank"">baseballheatmaps.com</a> (a site you could get lost in for about an hour before you even start making sense of it; that's a compliment), Beltre's average home run went from 294.75 feet in 2010 to 287.6 feet in 2012, losing distance every year.  To continue the Longoria comparison, his 2011 distance was 287.5 and 2012 it was 295.3.  If Beltre reverts to his career mark in HR/FB% and he loses another few feet on his homers, you're going to have him go from a 32-35 homer guy to a 26-29 homer guy.  Then where do balls go if they're not leaving the park?  In outfielders' gloves.  If that happens, does he start hitting more ground balls?  He has in years past.  This isn't saying stay away from Beltre, but he's later on my draft board than I've seen him elsewhere."17,Ian,Kinsler,,2B,102,25,77,0.258,20,,,,,,,"Someone in this tier, if not the whole tier, will fail.  I trust Kinsler as far as I can throw him.  And I'm one hundred and sixty pounds soaking wet, and have been to the gym three times in my life; each time to sign up for a one-year membership that I never used.  I can't throw Jose Altuve!  Between Kinsler and Nelson Cruz, the Rangers could do an off-Broadway adaption of M.A.S.H.  (It's the cross-dressing, Corporal Kinsler.), and that's the bulk of the Rangers offense.  Last year, Kinsler's HR/FB rate went into the toilet, but it seems to happen every other year, which leads him to hit 30+ homers every odd year.  He's second base's equivalent to Prince Fielder.   Call him Kingsler."18,Jose,Bautista,,OF,91,32,100,0.272,5,,,,,,,"Nothing in his line from last year looks necessarily bad if you account for bad luck.  According to out <a href=""http://razzball.com/playerrater-babipvavg/"">Expected Average Chart</a>, he should've hit .281.  The power was there as it's been.  Unfortunately, he had wrist surgery and wasn't able to swing a bat until November.  He says, I feel ""great"" and his strength is ""coming back quickly"" and the chicken parm is ""like Mama used to make.""  Hey, Bautista should work for Zagat.  I expect he'll be fine, but there's a chance he has a setback and you lose him for the year."19,Paul,Goldschmidt,,1B,84,29,104,0.274,12,,,,,,,"His 2012 reminds me of random middle infielder year like Asdrubal's 2011 or Aaron Hill's every fourth year he produces.  AuShizz had no business stealing 18 bags last year, and had every right to hit about ten more home runs than his 20 homer total.  For those that missed our <a href=""http://razzball.com/the-razzball-podcast-the-one-where-we-call-it-a-wrap-for-the-season-and-interview-steve-garvey/"">Steve Garvey interview</a>, Goldschmidt was the one guy Rudy and I agreed on that we are crazy excited about for thirteen after twenty.  His park is a solid hitters' stadium -- that's assuming the Diamondbacks don't trade away Goldschmidt because he has a Germanic last name -- ""Be gone, Krauts!""  That's Kevin Towers. -- and Paul has great upside.  Something that is not easy to find early in the 1st basemen rankings.  Out of this tier, I'm most excited about drafting Goldschmidt.   After this year, he'll be on everyone's radar."20,Adrian,Gonzalez,,"1B, OF",86,29,112,0.292,1,,,,,,,"Unlike Te(i)x, Konerko, Howard and other aging 1st basemen, I think A-Gon still has something left to give.  Oh, no, Rappin' Grey!  ""A-Gon's old like a reference to Minnie Pearl, coming off a disappointing year... Some things never go out like your preference for jheri curl and calling Montana God's Country and New Jersey God's Rear... A-Gon's still filled with diesel in that tank, no biggie... Maybe he needs Stoli and pineapple juice like Frank the Tank and Miggy...""  A-Gon's line drive rate went up to a career high in 2012 and his fly balls were normal.  His HR/FB rate was in the dumper.  He should've hit 27 homers last year.  His walk rate that has been on decline for the last three years hit a new low in 2012 at 6.1%.  For a guy that had a walk rate of 17.5% as recently as 2009, that's hideous.  Since he's only going to be 31 years old in May, I think he can hold his line drive rate and rebound a bit with his walks.  The homers will definitely rebound.  Remember, we are drafting for 2013, not for the mistakes you made in 2012.  Edwin Encarnacion was great last year, but unless you're driving a DeLorean to your fantasy draft that means absolutely nothing."21,Justin,Verlander,,SP,,,,,,20,7,2.71,1.03,234,0,"This is the first tier.¾ This tier goes from here until Felix Hernandez.¾ I call this tier, ""These guys are the best.¾ I will enjoy missing out on them."" There's a huge caveat to this tier below in Strasburg's blurb.¾ Verlander will definitely be drafted before I'm looking at starters.¾ He's terrific, fantastic, adjective!¾ I don't care.¾ Last year, I drafted one starter in the top 100 in the RCL and I had 57 out of a possible 60 pitching points.¾ Guys and four girls, you don't need a top starter."22,Troy,Tulowitzki,,SS,83,25,98,0.288,7,,,,,,,"This is a new tier.  This tier ends at Hanley.  I call this tier, ""These guys could be a'ight, but I won't own them because I'm drafting corner men or outfielders early.""  If you draft Tulowitzki, you'll probably lose your league.  Whether he stays healthy and produces or not.  The absolute best year I can expect from him is 30 homers, 12 steals and a .300 average.  Before you say he could do much better, he could, and aliens could land on Earth and make me ruler of the planet because they appreciate a good mustache.  I don't expect that to happen, just as I don't expect Tulo to match the best season of his career.  But let's assume as the new ruler of the planet I can make Tulo have a good season because with my new position as ruler, I have telekinetic power and they call me The Rainmaker and when I use my TK the only thing I'm interested in is Tulo hitting well but not the implications of time travel.  But as ruler of the planet, I also technically own every fantasy team so the victory is all mine.  Now, if I'm not ruler of the planet and Tulo has to go it alone, he will miss at least twenty games and disappoint yet again."23,Jose,Reyes,,SS,110,12,60,0.285,40,,,,,,,"I already went over my <a href=""http://razzball.com/get-discounted-players-with-miamitrade/"">Jose Reyes 2013 fantasy</a>.  I wrote it in while dusting inside my bubble."24,Dustin,Pedroia,,2B,90,17,100,0.291,20,,,,,,,"This is a new tier.  This tier goes from here until Seager.  I call this tier, ""This is your only chance for a decent 2nd baseman, but you do have about ten to choose from, so there's that.""  The good news and bad news are wrapped up tightly into a little bow for Pedroia.  He tends to play so balls to the wall like a deleted scene from Porky's that he misses games here and there or plays hurt, but he also gets his stats.  Since his first full year, only in 2010 did he fail to crack 15 homers and 20 steals.  You don't get the <a href=""http://razzball.com/fantasy-baseball-terms/#Sparky_Anklebiter"">Sparky Anklebiter</a> label without some grit, stick-to-itiveness and I-fink-U-freeky-and-I-like-U-a-lot-ishness."25,Matt,Holliday,,OF,92,26,100,0.304,5,,,,,,,"Phew!  I wasn't sure if I would ever get out of those other already-projected outfielders.  Oh, man, you made it here, but there's still some people clicking the links above.  We have to wait for them.  *scratches chin, makes a burping sound with hand under armpit, downloads a song by King Fantastic*  Okay, we need to move on.  They'll catch up.  This is a new tier.  This tier goes from here until Heyward.  I call this tier, ""You're still getting a top outfielder, but these young brothers have a few more issues.""  Well, not <em>young</em> young.  Hey, Matt Holliday!  He's been a top fifteen outfielder for the last five years minus 2011.  If you're predicting a step backwards like Kanye's last album, you're just guessing.  BTW, in ten years, we'll see the moment that Kanye rhymed ""visit"" with ""Scott Disick"" as the point when he began the slow, inevitable creative decline.  Someone getting their Master's in something useful like Urban Studies of the Modern Hip-Hop Man is probably writing a thesis on this.  A chapter title in their thesis is, ""Kim K. Needs to be Stopped, Can't Amber Rose Put Wiz On Hold and Throw Kanye a Bone?"""26,Stephen,Strasburg,,SP,,,,,,18,6,2.77,1.05,227,0,"It will take every bit of willpower to resist my urge to draft Strasburg this year.¾ I've seen him lower than the second starter overall and I almost ranked him first, so you can see how much I like him.¾ If he falls to the 5th through 10th starter off the board, I may just bite.¾ Verlander, Price and Kershaw have nowhere to go but down.¾ Strasburg has nowhere to go but up.¾ As frustrating as it was to watch Strasburg get shut down last September, 2013 owners will reap the rewards.¾ He could pitch 220 innings with a 10+ K-rate.¾ That is the most beautiful sentence in the English language.¾ Followed closely by, ""I am Kate Upton and I want to have sex with you then afterwards The Barefoot Contessa will make us meatloaf.""¾ So, basically, I'm telling you not to draft the first five starters under any circumstances, but if Strasburg is still on the board around the 6th starter, I ain't hatin', I'm liberatin'!"27,Ryan,Zimmerman,,3B,88,27,108,0.293,6,,,,,,,"This is a new tier.¾ This tier goes from here until Headley.¾ I call this tier, ""They've all burned me before but I'm not bitter, thanks to my shrink.""¾ My shrink, Dr. Fefferschtepper, says I have to learn to calm myself.¾ I have to learn to forgive.¾ I need to stop thinking that every time a player fails to leave up to expectations that it's some kind of personal affront to me.¾ I have to learn that when a player does live up to expectations after INEXPLICABLY not doing anything the first three months of the season and looking completely turd-bound at the plate, and then going on a barrage of production over the final three months to save their entire season right after I drop them that it's not meant personally.¾ That Ryan Zimmerman didn't mean to hit only 5 homers through the end of June, then ten homers in July.¾ Well, you could've fooled me, but I'll go on that touchy-feely perception of events and pretend Zimmerman isn't a total jackass sent directly from Planet Screw-Up-Grey with one mission in mind.¾ See, how well I've healed?"