Rank,First Name,Last Name,Team,Position(s),Runs,Home Runs,RBIs,Average,Steals,Wins,Losses,ERA,WHIP,Strikeouts,Saves,Blurb142,Jarrod,Parker,,SP,,,,,,14,7,3.61,1.27,176,0,"This is a new tier.  This tier goes from here until the top 60 starters for 2013 fantasy baseball.  I call this tier, ""A bunch of zeroes, and zeroes aren't a bad thing.""  The tier name means I have some reservations about these guys, but I also like them, which leaves me at neutral or at zero.  Zero is the new excitement.  I blame the recession.  If you've been reading for any length of time the Razz, the Rizzybizzy, the Razzputin, the RazzleBazzle, then you know I think Verducci is half confirmation bias and half cherry-picking.  So, I'm not giving much credence to Parker's large jump in innings from 2011 to 2012.  I'd prefer the jump wasn't there, but I also don't think we should just ignore the pitcher because of it.  Pitching is not a natural thing to do, and any of them could break down.  Even after being limited last year, there's a chance The Strasborg could break down.  Somewhere, Ralph Wiggum's wearing a Nationals hat and his heart just split in half.  Parker had a rough stretch in July (5.34 ERA) and August (4.71 ERA).  It might have been due to exhaustion, but his September was fine (2.31 ERA).  His K-rate last year wasn't anything special (6.95), but his K-rates in the minors were better.  Now combine a jump in innings, an unspectacular K-rate then subtract a good pitchers' park and a young pitcher that could get better and you're at zero.  Yay!  "143,Ian,Kennedy,,SP,,,,,,14,11,3.81,1.2,191,0,"In 2011, he was fourth in Cy Young voting.  Then he regressed last year.  As any scholar of <a href=""http://razzball.com/fantasy-baseball-terms/#Saberhagenmetrics"">Saberhagenmetrics</a> can tell you, it was bound to happen.  With neutral luck, he's a 3.80 ERA guy.  When he got lucky with long balls, he was a Cy Young candidate.  When his long ball luck regressed, he turned into a 4 ERA pitcher.  Looking deeper, it shows he stopped using his slider, reduced use of his curve and lost velocity on his fastball.  Doesn't it sound like he was injured?  Not to answer, but to mull.  You're cute when you mull.  C'mon, let me hug you-- Ah, I just pickpocketed you!  C'mon, man, pay attention."144,Mike,Minor,,SP,,,,,,11,10,3.87,1.22,181,0,"A big part of me thinks Minor is going to be better than Medlen this year.  The Lily Tomlin part of me to be exact.  Last year, his K-rate was 7.28, but he's shown to be able to push that above eight.  His walks are always in check.  Or prochˆzky, if he kept his walks in Czech.  To stick with the ambulatory theme, he needs to take a step forward this year to earn this ranking.  Cutting his homers allowed wouldn't hurt, getting lucky would be even better.  "145,A.J.,Burnett,,SP,,,,,,13,11,3.67,1.25,184,0,"He was basically the same guy last year as he's always been.  Hmm, that sounds like Carole King lyrics.  I wonder if the A in A.J. stands for apricot.  Probably.  So, Apricot, had to deal with big-time offenses from the time he went to the Blue Jays until he was done with the Yankees.  In the NL, Apricot's a great pitcher (I could've done the math, but I got lazy).  The reason why he's in this tier is for some reason it always seems like he needs an attitude adjustment to get motivated.  You're named after one of the most important crops of ancient Persia, cheer up!"146,Matt,Garza,,SP,,,,,,9,11,3.78,1.25,184,0,"If he gets 200 innings, he will have a 3.60 ERA and 195 Ks.  Yummers!  If he has a setback with his stress fracture in his throwing elbow, he can kizza his season goodbye.  Bummers!"147,Tom,Milone,,SP,,,,,,9,10,3.58,1.26,147,0,"This tier started in the top 40 starters for 2013 fantasy baseball.¾ This tier ends here.¾ I called this tier, ""A bunch of zeroes, and zeroes aren't a bad thing.""¾¾ Milone's ratio help, if nothing else.¾ If Milone could nudge up his 6.49 K/9 from last year to seven-plus, he could be a huge value pick here.¾ From The Files of the Obvious, it says going from 6.49 K/9 to 7+ K/9 isn't that dramatic of an approval.¾ I think getting to a 7+ K-rate for him is a pipe dream, because his fastball maxes out at 88 MPH.¾ The FotO also tells us major league hitters aren't exactly intimidated by an 88 MPH fastball.¾ He has the 7th slowest fastball.¾ Some guys below him:¾ Zito, Buehrle, Arroyo... And barely above him -->¾ Jered Weaver.¾ (And you wonder why I'm low on Weaver.)¾ Milone gets by with pinpoint control, which he always had in the minors, too. ¾Solid ratio man on the staff stuff, no bluff, Aubrey Huff.¾ Sorry, got a little Seussian there.¾"148,Tim,Lincecum,,SP,,,,,,12,10,3.98,1.28,199,0,"This is a new tier.¾ This tier goes from here until Haren.¾ I call this tier, ""Some are excited by these guys.¾ Even some writers on this site.¾ Not I (or is it me?).""¾ Could Lincecum bounce back is the question all of you are pondering.¾ Right after, where on earth did you put your pants.¾ You forgot to wear them today.¾ It's okay, no one comes by your cubicle.¾ Now back to the first question.¾ He lost two miles on his fastball last year.¾ That's not an absolutely killer unless you actually owned him in fantasy last year.¾ That guy shaking in the corner of the Subway station with the sign, ""Will not own Lincecum for food.""¾ Ask him what it was like last year owning him.¾ So, better than is he going to bounce back, is he going to regain two miles on his fastball and not have to throw more sliders and curveballs to make up for it?¾ Even if you correct for luck, he wasn't exactly solid last year.¾ Also, it wasn't like he started off fine and then hide an injury in the 2nd half.¾ He had a hideous 1st half and backed that up with a terrible 2nd half.¾ Wouldn't have Righetti and Bochy have put their heads together and formed one super-ginormous head and fixed Lincecum's issues by July if they could've?¾ I need about six starters per team and there's about forty pitchers I like.¾ I'm fine avoiding Lincecum."149,Drew,Stubbs,,OF,70,17,81,0.237,42,,,,,,,"I'm a sucker for Stubbs.¾ Feel free to go ahead and skip through to the comments and tell me I'm a damn fool.¾ I just get all moogly-boogly when looking at a guy that can easily give you a 15/40 season.¾ It's my cross to bear.¾ Or bare, if you're a religious nudist."150,Carl,Crawford,,OF,78,12,84,0.27,31,,,,,,,"This is a new tier.¾ This tier goes from here until Morse.¾ I call this tier, ""You turn my entire world upside/downside.""¾ Guys in these tier can be number one outfielders, and my projections might be a little ambitious, but what?¾ You want me to get excited about Nick Swisher?¾ Crawford is supposed to be ready for Opening Day after having Tommy John surgery last year.¾ He probably won't be able to throw his curveball, but his legs should be fine to steal bases, assuming he still has that aspect of his game.¾ He hasn't topped 20 steals since 2010, but his speed still looks to be there."151,Brett,Gardner,,OF,102,8,45,0.281,46,,,,,,,152,Starling,Marte,,OF,77,12,58,0.252,27,,,,,,,"I already went over my <a href=""http://razzball.com/starling-marte-2013-fantasy-sleeper/"">Starling Marte 2013 fantasy</a>.  I wrote it while hearing about the breeding history of a farm-raised chicken in Portland."153,Michael,Morse,,OF,69,26,84,0.288,0,,,,,,,"This tier is also filled with a bunch of guys that are getting by on good vibes and bad farts.  Morse is probably the worst offender of this.  If he didn't have 2011, he'd be a guy that always had promise but never had a healthy year or showed anything and he's about to be 31 years old.  Unfortch, we don't know if he'll be hurt again, and if he's healthy, he can give a 25+ homer, .290+ season.  He's a lot more valuable in shallower leagues where you can replace him with a waiver wire guy when he invariably gets hurt."154,Michael,Cuddyer,,"OF, 1B",71,22,84,0.271,9,,,,,,,"Okay, the first four of this tier could have solid bounce back seasons.  I like the idea of taking a flyer on a forgotten guy on the Rockies that should be a middle of lineup hitter.  Don't worry if you draft him and then yawn.  No one gets excited by the Cuddyer draft pick.  Balloons will not drop from your ceiling. "155,Paul,Konerko,,1B,72,25,84,0.277,0,,,,,,,"He will be 37 years old at the start of the season.  He must suffer from Mike Lowell-itis, because Konerko looks old enough to be my dad.  Hang out with Konerko for longer than twenty minutes and I bet he starts talking about Law &amp; Order reruns.  Just like my dad!  ""Hey, Grey, you ever seen the episode where they pulled the case right from the headlines?""  ""That's every episode, Konerko.""  ""Eh, guess you're right, where's your Mom at with dinner?"""156,Mike,Moustakas,,3B,75,25,92,0.259,3,,,,,,,"People seem oddly down on Moustakas this year, in the non-sexual way.¾ Last year, his line was 69/20/73/.242/5.¾ Throw the average out.¾ He's more a .260 hitter.¾ He hits a ton of fly balls, which isn't great for his average, but he could hit 30 homers with better contact and an uptick in his HR/FB rate.¾ At 24 years old, I could see Moustakas easily taking another step forward."157,Will,Middlebrooks,,3B,68,22,82,0.278,8,,,,,,,"I already went over my <a href=""http://razzball.com/will-middlebrooks-2013-fantasy-sleeper/"">Will Middlebooks 2013 fantasy</a>.  I wrote it slathered in Marshmallow Fluff.  "158,Manny,Machado,,3B,72,19,81,0.274,12,,,,,,,"I gots some love for this tier, huh?  Here's my <a href=""http://razzball.com/manny-machado-2013-fantasy-sleeper/"">Manny Machado 2013 fantasy</a>."159,Erick,Aybar,,SS,92,9,62,0.292,24,,,,,,,"All systems are a go for Aybar to have his career year.  In the Angels lineup, he's sitting in the two hole, which is coincidentally in front of Pujols.  That's right behind Trout.  Also in front of Hamilton.  That's sitting between beauty and fantasy beasts.  That's as of right now.  That's a big ""as of right now.""  That ""as of right now"" needs to buy two tickets to fly on a domestic airline.  The Sciosciapath could move Aybar to the eight hole on April 20th, win a game and decide to leave Aybar in the eight hole for the rest of the year."160,Derek,Jeter,,SS,81,11,55,0.288,10,,,,,,,"He was in a walking boot as of a few weeks ago.  No report on whether that was because he was locked in a cabin with A-Rod, who was unhappy with Jeter's memoirs, and screaming ""Dirty birdy!""  Everyone seems to think Jeter will be ready for Opening Day.  I think it's a strike against him already that we're in January talking about whether or not Jeter will be ready for Opening Day.  Then, Girardi said there's some concern over whether or not Jeter will be ready.  He said it with a long face, but that's more because he didn't want anyone making fun of his braces.  I expect we'll get 130 games from Jeter."161,Howie,Kendrick,,2B,70,10,78,0.29,14,,,,,,,"After being touted coming up through the minors, I thought he finally hit his career stride in 2011, which led me to believe 2012 would be amazing.  This crow I'm eating needs another 20 minutes in the oven, it doesn't taste right.  I really have no idea what happened to Kendrick's fly balls (they fit so snug!) last year, but he had a new career low, with his ground balls sky rocketing (not literally).  So, when he only had a 8.9% HR/FB rate with a 20.8% FB rate, his year turned into dreck.  I still think he can surprise if he elevates more balls, but I'm not counting on more than 12 homers."162,Alcides,Escobar,,SS,81,4,55,0.278,33,,,,,,,"This is a new tier.  This tier goes from here until Andrelton.  I call this tier, ""Piqued or peaked?""  Which also sounds like a Japanese game show.  Five Japanese businessmen sit in a circle and contestants have to guess which one of the businessmen has terrible indigestion and which one is just curious how he ended up on a game show.  This tier has guys that have my interest, but we might have seen the best already from some of them.  Last year, Alcides gave 5 homers, 35 steals and a .293 average.  Everything there looks to be the peak, except the steals.  In 2011, Alcides had a .285 BABIP and hit .254.  A high BABIP shouldn't be ruled out with Alcides's speed, but his .344 BABIP from last year looks to be on the high side."163,Pedro,Alvarez,,3B,60,27,81,0.245,1,,,,,,,"This is a new tier.¾ This tier goes from here until Prado.¾ I call this tier, ""I'm missing you (Tiers of a Clown).""¾ I might do a post about this, but let's talk quickly about cusp hitters.¾ I look at players that start tiers between favored tiers and unfavorable tiers as cusp hitters.¾ They were almost in a more favorable tier, but ended up starting off the less favorable tier.¾ Some cusp hitters over the last few rankings posts are Asdrubal, Infante, Utley, Jed Lowrie and Ryan Howard.¾ Cusp hitters are not as unfavorable as other guys in the tier.¾ Cusp sayin'.¾ Alvarez is as terrible as Mark Reynolds and Adam Dunn for Ks and, ergo, henceforth, vis-a-vis batting average.¾ I hear what you're saying, ""Grey, you're handsome as always today, but what I don't understand is you've liked Reynolds and Dunn in the past, even with their average, but you're down on Alvarez?¾ That seems like a double standard.¾ Is Alvarez not donkey-ish enough for you?""¾ I liked, neigh, loved Mini Donkey when I thought he could steal 15 bases.¾ Big Donkey had my admiration, bray, support, when I trusted him to hit .240 and 40 homers.¾ Alvarez has no speed, and doesn't look like a 40 homer hitter."164,David,Freese,,3B,74,18,90,0.297,3,,,,,,,"He probably doesn't deserve to be in this tier.¾ There's no reason to worry about Freese.¾ Or just no Freason, if portmanteaus tease your buddy like your right leg.¾ Except his past injury history.¾ Last year, he was more or less fine, playing in 144 games, which is excellent for a Cardinals team that is carrying on La Russa's tradition of making sure even the 12th man off the bench gets 50 ABs.¾ If Freese gets another 500 ABs, he'll have basically the exact same season as he just had minus a couple homers due to an inflated HR/FB rate in 2012."165,Josh,Johnson,,SP,,,,,,14,8,3.86,1.26,160,0,"Here's what I said when Johnson was traded to the Blue Jays, ""Little known fact, when I was under the age of eight, I used to call my johnson a Blue Jay of happiness. Did I say eight? I meant twenty-eight. *giggles like an embarrassed Lisa Simpson*¾In the past, the knock against Johnson has been his inability to stay healthy. This year, he made 30 starts for only the second time in his career. Unfortunately, he didnêt look like the dominant pitcher he was in 2009 or 2010. A huge drop in the strikeout rate and a bump up on his walk rate. ¾Thereês a possibility here for more, but I tend to think his name value will make him more valuable than heês worth, and with the league switch Iêd let someone else take the gamble he unearths his past glory. ¾I hear One-Eyed Willy buried it off the coast of a nondescript California town that looks the other way when child actors become drug addicts. Basically, every California town.""¾ And that's me quoting me!¾"166,Adam,LaRoche,,1B,73,25,95,0.26,1,,,,,,,"Another 1st base youngin'!  I will now call first base:  CBS, the Tiffany Network.  Here's you deciding about which guy to draft in this tier, ""Do I go with 60 Minutes or a CSI: Some City repeat?"""167,Anibal,Sanchez,,SP,,,,,,13,9,3.92,1.28,180,0,"This offseason, I wrote about Anibal, ""Tigers re-signed him (her?).¾ First clue that Iêm human, when I heard I was sitting on the same stool that was once used by a 90-year-old woman to sit on while showering, I shuddered.¾ Second clue that Iêm human, I loved Anibal going into last year.¾ Through two months, he had a 2.57 ERA and looked primed for a break out.¾ Things fell apart in June when he posted a 7.06 ERA and a 3.99 BB/9, easily his wildest month.¾ During the month of June, Anibal averaged a 91+ MPH, which is around what he throws, but his location was all over the map.¾ Not sure if he was struggling with mechanics ã you said it would only be $170 to fix the taillight! ã but he righted the ship as the season went on, and ending up having a 2.43 ERA in September.¾ A bigger concern is he threw his fastball a lot less in 2012 and lost any strikeout gains he made in 2011.¾ He looks like a number two to (stutterer!) three fantasy starter and, unlike going into last year, I donêt see the number one fantasy upside.""¾ And That's Me Quoting Me, Part 2:¾ The Return of Something I Already Said!"168,Dan,Haren,,SP,,,,,,7,6,3.95,1.27,120,0,"I already went over my <a href=""http://razzball.com/national-rent-a-arm/"">Dan Haren 2013 fantasy</a>.  It's a humdinger.  More dinger than hum, unfortunately."169,Hiroki,Kuroda,,SP,,,,,,15,12,3.68,1.19,165,0,"This is a new tier.  This tier goes from here until Vogelsong.  I call this tier, ""I like them, but if drafting one causes an erection for longer than four hours, see a doctor.""  It's hard to argue with the numbers Kuroda put up in New York last year.  I mean, you could argue with them, but then you'd be arguing with a bunch of integers.  Why not just wear a potato sack for a dress, you crazy person!  Am I surprised by said numbers?  Yes.  Am I willing to believe a guy with a career 3.42 ERA in 918 2/3 IP?  Still yes."170,Doug,Fister,,SP,,,,,,13,8,3.49,1.17,145,0,"You think when he's having a rough outing Leyland goes the mound and says to him, ""Happy?  Dugout -- Fister!"" and Doug's like, ""Who are you getting fresh with?""  Nah, probably not.  Last year, Fister had a 7.63 K/9.  Think that's about the upper reaches of his ability, i.e., Fister isn't known for his punchouts -- pun point!  Though, he does keep the ball down, has decent Ks and doesn't walk many.  He's better than he seems but it's hard to build excitement for Fister.  That's what she said!  Huh?"171,Josh,Beckett,,SP,,,,,,15,7,3.44,1.25,165,0,"This guy takes my fantasy dislike over to real world dislike.  He just seems like a douche.  I know, truly relevant fantasy analysis.  Well, it is kinda relevant, since I might have some real world prejudice against Beckett but I still like him this year a bit.  Beckett was a hair away from dropping to the last tier of this 20 (vets I don't like much).  His velocity dropped from 2011 to last year by two miles per hour.  His Ks fell off the table.  The only thing that has me not dropping him is he'll be in a great park and division to succeed, and he did last year after his trade to the Dodgers (2.93 ERA, 1.33 WHIP in 43 IP).  There's a good chance he's nothing more than a Capuano-type with a more recognizable name."172,Mike,Napoli,,"C, 1B",64,23,77,0.242,2,,,,,,,"I stepped away from the Napoli hype machine last year when he was being drafted in the top 70.  There was no way he was hitting for a good average again.  I will now put that sentiment to bed.  That Sentiment, ""Wait, could you read me one more story about how you still like Longoria even though he sucked for the last two years?""  Now there's major question marks about Napoli's hip and people are saying it could go at any moment or in five years.  For the right price, I'll take the 25 homer potential with the risk that his hip will be fine this year."173,Wade,Miley,,SP,,,,,,11,9,3.88,1.28,142,0,"Upfront I will say (well, upfront after I've written about 50,000 words on rankings), I like Miley but if people are drafting for last year's stats as they are prone to do, Miley will probably be off the table by this point.  I'm surprised I like Miley at all because he's not a strikeout guy.  He could easily regress to an under 6 K/9 rate.  That's terrible.  I've never liked anyone with that bad of a strikeout rate.  Patooey!  That's me spitting in the direction of his feet.  What has me intrigued -- intrigued, I tell ya! -- is how dramatically he cut his walks.  For K/BB (one of the best stats to see how good a pitcher is, but not infallible -- not infallible, I tell ya!), he was tenth best in the majors.  Above him, Bumgarner, below him Shields.  He had by far the worst K-rate in that top ten, but only Blanton from that top ten hasn't been ranked yet.  It should be obvious, but when you're striking out people way more than you're walking them, good things will happen.  But when doing it with so few strikeouts bad things can happen pretty quickly.  So I like Miley -- weird! -- but if someone drafts him earlier, don't sweat it."174,Glen,Perkins,,RP,,,,,,2,5,2.91,1.09,74,29,175,Casey,Janssen,,RP,,,,,,3,2,2.78,1.07,67,37,176,John,Axford,,RP,,,,,,3,3,3.1,1.18,90,34,177,Jonathon,Lucroy,,C,61,16,76,0.272,0,,,,,,,"This is a new tier.  This tier goes from here until McCann.  I call this tier, ""Five Shades of Grey."" What I mean by the tier name is the five players in this tier go from ""I kinda like them"" to ""I kinda hate them"" with shades of like and hate differentiating them with the middle guy leaving me indifferent.  Lucroy was a beast vs. the Cubs (4 homers, 20 RBIs, .350 average in 40 ABs).  Against everyone else he was pretty mediocre.  I kinda like (see?) Lucroy because he was the 11th best catcher season last year and he missed close two months.  At 26 years old, there's a chance for some upside here."178,Miguel,Montero,,C,59,16,76,0.27,0,,,,,,,"I kinda like (see again?!) Montero a little less than Lucroy (man, these rankings are making sense now!).  Montero looks completely capable of repeating his 2012 season (15 homers, .286), but under the surface there's some issues.  His strikeout rate ballooned to 22.7% and he had a .362 BABIP.  He could have easily hit .260 or worse last year.  That would hurt his counting stats, which is propping up his perceived value. "179,Yadier,Molina,,C,58,13,68,0.295,6,,,,,,,"Here's indifference.  <em>Molina was the second best catcher last year, but I have him 12th?! What gives, Grey-mo-sabi?</em>  Well, Random Italicized Voice, that's a good question.  <em>Yeah, no kidding.  That's why I asked.  Now stop with the preambles and give me some info.</em>  Okay, so Molina had a sub-10 HR/FB% coming into last year.  Then in 2012 it was 13.8%.  It's been steadily climbing, but so is his age.  A career year at thirty years old is improbable.  A year when he hit more homers than his previous two seasons combined is silly.  I'm not into silly.  His steals last year were the two previous years combined, too.  That's ludicrous.  I'm not into ludicrous, though Word of Mouf was a decent album.  Maybe Molina found the fountain of youth, maybe he's Benjamin Button.  Whatever the case, I'm not buying in."180,A.J.,Pierzynski,,C,51,15,60,0.265,0,,,,,,,"You know how the day after every fantasy draft you go to a t-shirt printing shop to have your team's jerseys made with every player's last name?  I'd hold off on adding Pierzynski's, and not simply because the place charges per letter.  I don't buy that Texas is gonna stave off him reverting to what he was every year, except last."181,Brian,McCann,,C,40,12,57,0.242,0,,,,,,,"I've been a McCann apologist for a few years now.  Or if McCann reads Razzball, then I'm an enabler.  I'm officially done with him.  Not because I don't think he's a capable hitter (there I go apologizing for him again), but he had shoulder surgery that will cause him to miss the first couple of weeks of the season.  A couple of weeks isn't a huge deal.  When I was a teenager, I once had an erection for a few weeks straight and that wasn't a big deal.  Sideways emoticon.  I'm not drinking any f**king Merlot!  Shoulder problems can linger for a hitter.  I wouldn't go near McCann this year."182,Neil,Walker,,2B,75,14,82,0.272,9,,,,,,,"I don't like Neil Walker at all.  Frankly, I don't like any hitters where you are completely reliant on counting stats and don't call me Frank Lee."183,Kelly,Johnson,,2B,68,17,59,0.246,13,,,,,,,"He's still a free agent as of right now, so he could fall off this list completely if he signs as a back-up or in Japan.  At six-one, he could be huge in Japan.  ""We've got trouble, someone get Mothra!""  I've given Johnson projections for a full season of ABs, so it's doubtful he moves up this list."184,Corey,Hart,,"1B, OF",72,26,78,0.273,5,,,,,,,I'm half expecting Andy Rooney to resurrect himself in this tier.  185,Mark,Reynolds,,"1B, OF",79,29,88,0.226,6,,,,,,,"Hey, it's Mini Donkey!  Another guy that technically isn't that old compared to the rest of this tier.  He'll only be 30 years old this year.  Oh, crap, I used to think 30 years old was old.  DAH, I'M GETTING OLD!"186,Adam,Dunn,,1B,82,35,95,0.212,1,,,,,,,"The reason why I'm not saying much about these guys is because if you don't know about the guys in this tier by now, I can't help you.  Now get off my lawn!"187,Nick,Swisher,,"OF, 1B",72,24,85,0.261,2,,,,,,,Swisher started shaping his sideburns before Luke Perry.  Should give you an idea how long this guy's been around.  188,Kevin,Youkilis,,"3B, 1B",74,20,88,0.259,0,,,,,,,"When he signed with the Yankees, I said this, ""Youk to the Yanks.  Or as The NY Post shouldêve called it, –O, Yuk.”  The 3rd base free agent market looks like one of those Day-After Christmas Sales when the sales girl says, –Um, yeah, I think we have mittensÄHave you tried under that giant pile of picked-through clothes?”  And Youk is a set of mismatched mittens under the picked-through clothes.""  And that's me quoting me! "189,Lance,Berkman,,1B,64,19,77,0.279,3,,,,,,,You know you belong in the Cougar Love tier when your player page picture has you with gray hairs coming through your beard.190,Justin,Morneau,,1B,70,24,78,0.265,1,,,,,,,"Hey, it's Grandpa Simpson playing 1st base!   ""I got a funny story about that.  Well, it's not so much funny as it is long."""