Rank,First Name,Last Name,Team,Position(s),Runs,Home Runs,RBIs,Average,Steals,Wins,Losses,ERA,WHIP,Strikeouts,Saves,Blurb58,Adam,Wainwright,,SP,,,,,,16,8,3.12,1.19,193,0,"Honestly, where I see Wainwright being ranked by other fantasy baseball 'perts, there's little reason for me to believe I WON'T own him.¾ Caps for emphasis, not because my shift key is sticky.¾ Due to a career low in men left on base, his 2012 ERA of 3.94 is a world away from his 3.23 xFIP.¾ I was worried about him last year because he was returning from surgery, but, really, I had nothing to worry about.¾ He was much better than his ERA shows and exactly where he was prior to surgery.¾ As he had an ERA near 4 last year, he could easily have a two and a half ERA this year.¾ Wain-so-wright, my tootsie hole, and I'm in.¾ (My tootsie hole is my pet name for you.¾ You're cute.)¾"59,Billy,Butler,,1B,75,26,95,0.309,1,,,,,,,"You know what I want to see?  Of course you do.  I want to see Billy Butler celebrate every home run with The Truffle Shuffle.  The top of the Royals order looks like it could have #2012oriolesproblems, which, as we saw with Adam Jones last year, hurts Butler.  Also, he looks closer to a 24-27 homer guy than a 29-32 homer guy, and he only gets a steal when everyone on the field thinks time has been called even though it hasn't.  Butler moves up a bit if you have a category in your league, ""Ability to fill out a bikini."""60,Ike,Davis,,1B,76,34,102,0.259,,,,,,,,"This is a new tier.  This tier goes from here until Freeman.  I call this tier, ""Not as exciting as the above tier or the tier below it, but should be safer.  Yay, safety!""  I already went over my <a href=""http://razzball.com/ike-davis-2013-fantasy-sleeper/"">Ike Davis 2013 fantasy</a>.  It was written in Wingdings font then translated back by someone fluent in Wingdingian."61,Allen,Craig,,"1B, OF",67,23,83,0.315,3,,,,,,,"I'm preparing myself for moving Craig down the rankings when he gets hurt in Spring Training.  If he stays healthy, he'll give you exactly the same season as Moobs Butler with maybe three more steals.  There's no way he stays healthy, so then you have to ask yourself how deep your league is and whether or not you can replace him for all three of his DL stints.  Use your internal monologue to ask yourself, I'm trying to read.  (On a side note:  <a href=""http://www.gloves4troops.com/Gloves_4_Troops/Gloves_4_Troops.html"" target=""_blank"">A Cardinals minor leaguer</a> is hoping to send 1000 baseball gloves to overseas troops by Spring Training.  Go there for the details, and send him a baseball glove.)"62,Carlos,Santana,,"C, 1B",79,26,94,0.259,3,,,,,,,"I considered putting Santana third and Wieters here, then I thought about how you shouldn't draft either so whatever, but then I thought even if I'm telling you not to draft them I should still rank them correctly, then I took a nap, then I woke up and thought about how kitchen appliances haven't changed much since the invention of the microwave -- weren't we supposed to get hydrators by now?  Then I remembered I was ranking catchers and put Santana here.  He made solid gains in his strikeout rate.  His fly balls were down a bit (literally), but his line drives bounced back (not literally; that would be dangerous).  He should've been better last year = He should be better this year.  Wieters or Santana or both are going to have their best seasons to date as they enter their prime.  It's all very exciting, wake me when I get to a tier I can draft from.  "63,Ian,Desmond,,SS,68,20,77,0.264,18,,,,,,,"In 2009, Ian Desmond hit the second longest homer for the Nationals behind only Adam Dunn.  That trivia has stuck with me because it means Desmond isn't a 12-homer guy masquerading as a 20-homer hitter.  Besides that being one of the worst costumes ever  -- are you at a masquerade ball dressed as J.J. Hardy? -- it gives a baseline for power.  Of course, I'm not ignoring his 2011 and 2010, but his power in 2012 is actually closer to what we should expect.  I do fully expect everything else in his stat line to come down.  ""Kick it down a notch!"" says Opposite Emeril."64,Jordan,Zimmermann,,SP,,,,,,14,10,3.09,1.13,172,0,"I'll put it to you as plain as that hairy mole on your cheek that you nicknamed Brad.¾ If Zimmermann does not take a step forward, he'll be worth this draft slot.¾ Now to get you all jazzed, Kermit Ruffins.¾ He's 26 years old and about to enter his third season starting, the time when pitchers really break out.¾ In the minors, he showed a lot more Ks and last year his K-rate went up a tick from 2011.¾ His fastball also got a hair faster.¾ He gives up absolutely no free passes (13th best in the majors for starters).¾ Quick math for you:¾ Ks + no walks = Franois Truffaut.¾ Whoa, my math was way off there.¾ It was supposed to equal number one starter."65,Mat,Latos,,SP,,,,,,16,9,3.33,1.12,188,0,"As I went over in my <a href=""http://razzball.com/eric-hosmer-2013-fantasy-sleeper/"">Eric Hosmer sleeper</a> post, I wrote how I worry that I'll sometimes go back for more abuse because of a self-fulfilling, self-defeating self-self-self thing.  Latos falls into that category.  I drafted him last year and got none of the stuff that made Dallas Latos fall in love with him (I'm talking on the field; not the ceiling bedroom mirror or the three Pomeranians).  His 2nd half 2.84 ERA while limiting hitters to a .215 average are the stuff dreams are made of, assuming your fantasies are about fantasy.  You literal, sumbitch! "66,Matt,Moore,,SP,,,,,,15,9,3.19,1.23,225,0,"Before you start lambasting me like the turkey you think I am for ranking Moore here, no one is drafting Moore 16th overall for all starters.¾ You draft, say, Greinke, then you wait seven or so rounds and draft Moore.¾ He's your 2nd starter.¾ The same way I drafted Bumgarner and Gio last year.¾ You want me to sit here -- and I am sitting -- and rehash end of the season rankings and say that's what you should do for 2013?¾ Is that helpful to anyone?¾ I'm telling you how to draft for 2013, not 2012.¾ There are a ton of rankings that just rehash last year.¾ I'm sure you can find them.¾ No, Moore, wasn't great last year with a 3.81 ERA and an even worse 4.35 xFIP.¾ He had a 3.01 ERA 2nd half ERA and that was with a terrible month of September (5.48).¾ His 2nd half walk rate was 3.61 compared to his 4.54 in the first half.¾ In the minors, he didn't have control problems.¾ Something was off in the first half of the year.¾ He had the 12th best K-rate last year at 8.88.¾ That number is paltry compared to his minor league numbers.¾ He has 10+ K-rate stuff.¾ Wanna a guy who gives top five starter numbers but comes at a third of the cost?¾ What Moore do you need?"67,Aramis,Ramirez,,3B,72,24,87,0.277,3,,,,,,,"This is a new tier.¾ This tier goes from here until Freese.¾ I call this tier, ""I'm worried about this tier.¾ Perhaps irrationally so.¾ Who's irrational?¾ Me?""¾ Aramis is going to be 35 years old in June.¾ I don't tell you this so you can set your iCal reminder to send him an e-card.¾ At some point, the wheels are gonna come off.¾ Now it will either be a slow, steady decline where we get 25 homers this year, 22 homers next year and then we're praying for 20 homers the following year but only get 12.¾ Or maybe the wheels come off this year and then he struggles to get the wheels back on for a few years until he retires.¾ Or maybe he's going to get better at the age of 35 like Barry Bonds, Rafael Palmeiro and Mark McGwire.¾ Emoticon with a needle sticking into its butt."68,Brett,Lawrie,,3B,74,17,83,0.278,14,,,,,,,"Obviously, Lawrie said something nasty to Dwayne Murphy and Murph didn't share with him the special homer sauce that he gave to Bautista and Encarnacion.¾ If I were Dwayne Murphy and Dwayne Murphy were still the Blue Jays hitting coach, I'd tell Lawrie to stop hitting every pitch into the GEE DEE ground.¾ Ground balls, super-friendly hops aside, are not how you hit home runs.¾ His 50.2% GB rate was up there with such homer stalwarts as Ichiro, Daniel Murphy and Jemile Weeks.¾ Emphasis on ""warts.""¾ He needs to drop that rate to around 45% and raise his fly ball rate (which was 29.8%) to around 34%.¾ All doable things.¾ If he does that, he'll hit 15 homers even with a terrible 9 % HR/FB rate as it was last year.¾ If he raises that just a tad, he hits 20 homers. ¾ The steals are another whole set of question marks.¾ He has speed, but 13 steals and 8 times caught as it was last year isn't gonna cut the cheese.¾ Isn't gonna butter the biscuits and definitely isn't gonna mustard up the hot dog.¾ Last year was a lost year.¾ He could easily turn things around a'la Heyward from 2011 to 2012, but there's no guarantees here."69,Aroldis,Chapman,,"SP, RP",,,,,,12,4,2.9,1.1,170,0,"I already went over my <a href=""http://razzball.com/a-role-dis-chapman-was-born-to-play/"">Aroldis Chapman 2013 fantasy</a>.  It was written between G and TL.  "70,Aaron,Hill,,2B,86,22,80,0.263,12,,,,,,,"I have little faith in Hill and this is after the love of Tim McGraw helped her get through a tough stretch.  *checking notes*  Oops. I have no faith in Aaron Hill, and this is one of the good 2nd basemen -- yay!  He seems completely capable of a year where he hits 5 homers and .215.  All we have to go on though is what he should be with all things being equal.  Last year, his HR/FB% was 11.2 -- repeatable; his 12.9 strikeout percentage -- repeatable; and his 14 steals are, well, you know.  He could go 20/20 with a .280 average, but I don't feel completely confident."71,Elvis,Andrus,,SS,91,5,60,0.285,35,,,,,,,"In the past, if Josh Hamilton had a bad season, it meant a solid steal season from Andrus.  Well, we don't have to worry about that Hamilton guy anymore adding so much offense that it was encroaching on others.  The nerve!  Or noive, if you're reading this in a Curly Howard voice.  Andrus has been consistent across the five fantasy categories, except steals, which makes him exceedingly frustrating because that's what we rely on from him.  <em>Tell me something I don't know! </em> Sorry, Random Italicized Voice, how about only Reyes and Jeter have scored more runs than Andrus in the last three years?  <em>Oh, my last comment was a figure of speech, I didn't need to know anything else.</em>"72,Austin,Jackson,,OF,105,15,62,0.288,20,,,,,,,"I almost put Austin Jackson in the top 20.¾ I was thisclose.¾ Nay!¾ Thisclose.¾ Is that closer?¾ Yeah, it is.¾ But Jackson's in the same tier as guys in the top 20, so it's kinda like they're together.¾ They can go for drinks together.¾ ""Whaddup, Desmond Jennings?¾ We were in the same tier on Grey's preseason rankings!""¾ That's Austin greeting Jennings at the All-Star Game.¾ The lack of walks from Jackson in previous seasons scared the bedeityofchoiceus out of me.¾ The Ks weren't something I liked.¾ I had concerns about Jackson four ways to Wednesday.¾ Last year, he raised his walks, lowered his Ks and made solid contact.¾ The steals were a bit low (12), coupled with 9 times caught stealing.¾ That's a concern, but he's fast and 26 years old.¾ Me likey.¾ Guys and four girls, please draft Austin Jackson."73,Alex,Gordon,,OF,92,27,105,0.29,10,,,,,,,"Here's one place I go a tad screwy.¾ The other guys in this tier are clearly number one outfielders or obviously headed that way.¾ There's issues with some of them, but you see their number one-ness.¾ Last year, Gordon hit 14 homers.¾ Yay.¾ Placido Polanco called and asked him if he wanted some power hitting tips.¾ I'm looking at Gordon's peripherals though, and I'm really liking what I'm seeing.¾ His walks went up, line drives went up (not literally) and Ks went down.¾ His fly balls went down (literally), but not to the point where we need to be alarmed.¾ His doubles are insane (51 last year) and he's going to be 28 years old, which I'm hoping means this is the year his power peaks.¾ He needs luck here, but if he hits enough ""Just enoughs"" (almost stutterer!) and has another 150+ game season, he's going to be a huge breakout for 2013.¾ The markings are on the wall; he just needs to tag the ball.¾ Banksy approves."74,Hunter,Pence,,OF,81,24,95,0.284,7,,,,,,,"This is a new tier.¾ This tier goes from here until Markakis.¾ I call this tier, ""We had some good times with these guys.¾ Like that time when we...Uh... And that other time!""¾ This is gonna be a long tier of players you all know more or less and who've you've gotten more and/or less from depending on their season.¾ Each guy is six of one/half dozen of another.¾ Everything from last year looks repeatable for Pence with a touch higher average.¾ The problem, of course, he only hit 25 homers and stole 5 bases.¾ If he's not stealing 15 bases a year, like he's a few years removed from, then his value drops to a solid number two outfielder, but not a number one."75,Alex,Rios,,OF,88,19,70,0.281,18,,,,,,,"Rios's career reminds me of the Game song, Martians vs. Goblins.¾ In the general sense.¾ Not in the general sense that it's a phenomenal song, but in the general sense that Rios looks schizophrenic from year to year, fighting with himself over what he is.¾ B**ch, I'm a motherf**kin' martian, I'm a goddamn goblin!¾ So, will Rios fall back like LeBron's hairline, sucking like with wonton soup or will his power be limitless like Blanka on Sega Genesis?¾ I have no idea.¾ Keep in mind, last year I told you to draft him and this year I'm weary because he's priced much higher.¾"76,Nelson,Cruz,,OF,74,25,86,0.265,7,,,,,,,"He's a number one outfielder...If he doesn't get hurt.¾ That ""if"" is bigger than Tarantino's ego.¾ So, will Cruz rebound nicely without Hamilton or will he do Jackie Brown, some high profile karate crap and some period pieces that are wrapped in a bow by the media pretending to be more than they are, which is nice in parts, but poor as a whole?¾"77,Carlos,Beltran,,OF,75,23,89,0.279,10,,,,,,,"You know the hot garbage you leave out over night then decide to make a hat out of?¾ That was Beltran in the 2nd half of last year.¾ It was a garbage hat.¾ His 2nd half:¾ 33/12/32/.236/5.¾ I just vomited in my mouth then spit it on the floor and it spelled out, ""I'm vomit.¾ What's up?""¾¾ If that 2nd half is any indication of which way this 35-year-old is headed, I'd stay away.¾ But his 1st half was green money.¾ I think we'll probably get somewhere between the two for the full 2013 season, which is still a'ight."78,Freddie,Freeman,,1B,90,25,98,0.267,2,,,,,,,"Member when you were a kid and trying not to step on any cracks for fear of repercussions about someone else having their back broken?  Instead of taking a regular step forward, you'd take a measured half step forward which landed in you in a safe spot.  That's the kind of step forward Freeman took last year.  At 23 years old and going into his third full major league season, there's a chance for larger step forward, but I expect another small one."79,Mark,Trumbo,,"OF, 1B",62,28,82,0.258,5,,,,,,,"This is a new tier.  This tier goes from here until Hosmer.  I call this tier, ""Two of these guys will be good value, two of these guys will be terrible value, one of these guys will be great value, one of these guys will just recoup their value... Wait, how many guys is that?""  This is where the 1st basemen rankings get confusing, hence the tier name.  The next tier have names everyone knows but are on a serious downturn of their career.  This tier is filled with guys that are high risk and high reward that could easily outperform the above tier, and, according to our <a href=""http://razzball.com/playerrater/"">Fantasy Baseball Player Rater</a>, some already did outperform them last year.  How did Pujols, Trumbo and Morales all get 1st base eligibility again on the same team?  Did they have two 1st basemen on the field at once and no 3rd baseman or left fielder?  Yes, but technically only one of them was playing 1st at any given moment.  This tier of players could also be considered high risk/high reward.  Trumbo and Davis are probably the two biggest for that.  I wouldn't be shocked to see Trumbo have a three homer, .205 month of April and lose a starting job to Vernon Wells.  Remember, Trumbo's 2nd half last year was of the .227 with 10 homer-variety, where he sat out 7 times in the final 30 games."80,Jered,Weaver,,SP,,,,,,16,7,3.33,1.1,172,0,"This is a new tier.  This tier goes from here until the top 40 starters for 2013 fantasy baseball.  I call this tier, ""On my HP Tablet, I designed this tier to be lower than others have them.  Now excuse me while I go over to the Nine West accessory wall.""  Unlike the first tier in the top 20 starters, this tier is meant to ignore because I don't trust any of these starters.  They all have flashing signs over their heads that read, ""I'm gonna fail to live up to expectations.""  The sign is in 8 point font so it can fit the whole phrase on there.  Where do we start with why Weaver is a flipping mess?  His K-rate last year -- burp.  His xFIP last year -- burp, burp, fart.  His fastball velocity last year -- fart, fart, shart.  I nearly dropped him out of my top twenty, but I felt ranking him here was late enough so he'd be off the board by the time I needed to draft a starter.  Also, I'm only drafting one pitcher from all twenty of these guys, chances are I won't need Weaver."81,Jonathan,Papelbon,,RP,,,,,,4,2,2.55,1.02,85,43,82,CC,Sabathia,,SP,,,,,,16,10,3.56,1.2,188,0,"In the offseason, he had a bone spur removed from his elbow.  The Yankees' pitching coach, Larry Rothschild (no relation to Larry Rothsbrother) said that the Yanks would limit CC's workload in 2013.  When a pitching coach is talking about limiting a pitcher in December, how much better do you think the pitcher is going to get, say, 150 innings into the season?  If you answered ""less better,"" that's an awkward phrase but I understand what you mean.  "83,Chris,Sale,,SP,,,,,,13,6,3.45,1.18,178,0,"I'm here from the future.  *wavy lines*  The day is August 1st, 2013.  Greetings, earthlings!  Don't worry, I'm not an alien.  I'm also an earthling.  But the greeting, ""Greetings, earthlings!"" becomes a common thing to say in July of 2013 to your friends after a little known Bangladeshi artist, Bappi, comes out with a YouTube sensation, ""Greetings, Earthlings-style!""  Some think it's just a lazy Gangnam rip-off, but... Anyway!  On August 1st, 2013, Chris Sale brings his 4.00+ ERA back from the DL and I say, ""He threw too many innings in 2012 and it's caught up to him in a bad way.  I told you not to draft him, earthlings.""  So now when I quote that, I'll be able to point out how I was right about Chris Sale and Bappi."84,R.A.,Dickey,,SP,,,,,,16,8,3.38,1.17,182,0,"When Dickey went to the Blue Jays, I wrote up my <a href=""http://razzball.com/getting-dickey-is-all-in-the-extension/"">R.A. Dickey 2013 fantasy</a>.  There's only two cock jokes.  Sorry, ladies."85,James,Shields,,SP,,,,,,13,10,3.77,1.26,198,0,"When Shields went to the Royals, here's what I said, ""Poor guy.¾ Now he has to contend (bad word choice) with the Royals.¾ Heês gonna forever be known as the guy the Royals gave Wil Myers away for (and Mike Montgomery and Jake Odorizzi ã Jesus!).¾ In 2011, he had an xFIP of 3.25.¾ In 2012, he had a xFIP of 3.24.¾ In 2011, he had a K-rate of 8.12.¾ In 2012, he had a K-rate of 8.82.¾ In 2011, he had an ERA of 2.82.¾ In 2012, he mightêve had a better year even though his ERA was 3.52.¾ Thatês the good news.¾ The bad news is his Home ERA in his career is 3.33, and his Away ERA is 4.54.¾ Sure, his Fenway ERA was 5.86 and Yankee Stadium ERA was 6.35, but his Kaufman Stadium ERA is 6.38, his Progressive Field ERA is 4.44, his Hubert H. Homerfree Retrodome ERA is even 3.79.¾ The only place heês had success is in Comerica.¾ I was going to like Shields this year.¾ Now, Iêm not messing with him.""¾ And that's me quoting me!¾"86,Yu,Darvish,,SP,,,,,,15,10,3.74,1.24,228,0,"This is a a new tier.¾ This tier goes from here until Peavy.¾ I call this tier, ""I'll grab one of these guys when possible; just not going apeshizz cray cray."" What I mean by this tier is I'll probably not sweat it if someone drafts one of these guys prior to me, but I will draft them if they're there (stutterer!).¾ In April and September, his ERA was 2.20 in 69.2 inning. ¾In May, June, July and August, his ERA was 4.87 in 121.2 IP.¾ So it looks like dealing with the Dallas heat was Darvish's biggest hurdle last year.¾ A leaguemate watching you at your 2013 draft, ""Why are you reading the Farmer's Almanac?""¾ You, ""Seeing if it's going to be any cooler in Texas this year.""¾ Al Gore enters your draft with a PowerPoint presentation, ""As I was saying as consultant of The Beasts of the Southern Wild, there's ice caps melting at such a rapid rate--""¾ Everyone at your draft, ""Noooooo!¾ Not Al Gore!"""87,Yovani,Gallardo,,SP,,,,,,15,10,3.69,1.26,205,0,"The great (and peaceful) strides made by YoGa in 2011 for his walk rate went poof...in the wind.¾ If he regains his 2011 walk rate, he'll be a top 15 starter.¾ Luckily, due to his Ks, he won't be worse than around the 24th ranked starter, so I ranked him here.¾ Cool, huh?¾"88,Kris,Medlen,,SP,,,,,,13,8,3.44,1.18,161,0,"I tried to figure out how to get Medlen in the top 20 starters for longer than I can to admit (117 minutes).  Then I looked at my projections for him (a high 7 K-rate and a 3-something ERA) and I couldn't justify it.  If you do skip the Weaver tier from the top 20, then you might get Medlen anyway.  His K/BB is a thing of beauty.  Really, he's not that far from Jordan Zimmermann Ks and walks-wise, maybe even better.  But the sample size on Medlen had me lower him.  Remember, the last year he started games (2010) he had a 3.86 ERA, 1.21 WHIP as a starter.  I love someone like Medlen off waivers.  I really don't want to pay top 20 price for him.  So, for 2013, I might be <a href=""http://www.youtube.com/watch?v=-EF91gJ6D0E"" target=""_blank"">Without Medlen</a>."89,Jake,Peavy,,SP,,,,,,12,6,3.6,1.14,175,0,"He has a career 3.46 ERA and only once in his ten-year career has he had a year of 200+ innings and a 4+ ERA.  That was back in 2006.  Unfortunately, since 2002, he's only had 4 seasons of 200+ innings.  So, if he's healthy, he's going to be a solid starter.  Within that ""if"" lies all of Peavy's problems.  Peavy is standing in a corn field in 2044 Kansas and suddenly that ""if"" appears with a hood over its head and gold bars taped to its back.  It's now up to Peavy what he's going to do."90,Danny,Espinosa,,"2B, SS",78,19,58,0.245,20,,,,,,,"As long as his K-rate continues to trend up, which is down, I don't expect him to ever make a legitimate step forward without a huge BABIP year.  Like a .350+ BABIP-type year, i.e., he needs to get very lucky to hit above .255.   I before E except in Teixeira, I like Espinosa but he will be an average drain and have months where you're wondering why you ever drafted him."91,Anthony,Rizzo,,1B,74,24,86,0.259,6,,,,,,,"A to the nthony could easily outperform AuShizz, there's a sample size concern to his major league numbers.  Do we reject the notion of a sophomore slump after we've seen notable cases like Heyward, Lawrie and Hosmer succumb to it the last two years?  Do we reject the notion of Rizzo's 16 homers, .245 over 136 major league games is terrible even if his 2012 was solid?  Do we reject the notion that he can't hit lefties (.208 against)?  Do we say 'reject the notion' if we're not trying to sound pompous?  *pounding gavel*  I've got questions, y'all!  I don't think I'm going to be owning Rizzo in 2013.  Blame Hosmer last year.  Shoot, I've blamed him for everything else rotten in my life."92,Matt,Wieters,,C,71,24,85,0.264,2,,,,,,,"Watching the transformation of Wieters from top prospect to top catcher is like watching a slow motion video of a flower blooming.  Hey, here comes the pistil!  *seven months later*  I think that's a petal!  It'll be beautiful one day, but, man, this is taking forever.  "93,Joe,Mauer,,"C, 1B",83,13,89,0.315,7,,,,,,,"I have him lower than most other fantasy baseball 'perts because I can't understand why anyone would draft a catcher as high as Mauer's going when he's a 10-ish homer, 7-ish steal guy.  As far as I'm concerned, I'm not down on Mauer.  Everyone else is, in the sexual way.   He plays in a terrible park, his lineup looks it was ravaged by West Nile virus and he hits ground balls like he's a middle infielder.  Only five players had a worse fly ball percentage last year:  Ben Revere, Jeter, Jamey Carroll, Howie Kendrick and Elvis Andrus.  A lack-of-power hitters after him on the list continues:  Alcides, Michael Young, Denard Dawg, Ichiro, Bourn... Does this sound like a group of hitters you want a player associated with if they have less than 90 runs/RBIs and 10 steal potential?  The short answer is no.  The long answer is nooooooooooo."94,Jason,Motte,,RP,,,,,,5,3,2.62,1,82,41,95,Mariano,Rivera,,RP,,,,,,3,1,3.08,1.12,50,35,96,Chris,Davis,,"OF, 1B",66,28,82,0.251,2,,,,,,,"Last year, he had a 30.1% K-rate and a .270 average.  Out of the 12 guys with a K-rate 26.4% and more, the next best average was .253 by Kubel at 26.4%.  Since 1980, there's two guys with a K-rate above 30% with a .270 or better average.  Davis and Jose Hernandez, who hit .288 in 2002 with the help of a .404 BABIP.  Chris Davis either has to make adjustments or he will hit .240."